{
  "schema": "autocfd5-aiml-entry-v1",
  "schema_version": 1,
  "submission_id": "assigned-submission-id",
  "method_name": "Example method",
  "contact_email": "participant@example.org",
  "training_regime": "from_scratch",
  "target_data_used": "official_train",
  "external_pretraining": false,
  "pretraining_data": [],
  "split_id": "full",
  "prediction_scope": "surface_and_volume",
  "force_prediction_source": "field_integrated",
  "test_case_ids": [
    "run_11",
    "run_12",
    "run_19",
    "run_20",
    "run_24",
    "run_26",
    "run_29",
    "run_41",
    "run_55",
    "run_59",
    "run_108",
    "run_124",
    "run_127",
    "run_133",
    "run_142",
    "run_158",
    "run_173",
    "run_180",
    "run_187",
    "run_188",
    "run_197",
    "run_199",
    "run_203",
    "run_205",
    "run_207",
    "run_208",
    "run_210",
    "run_215",
    "run_222",
    "run_226",
    "run_258",
    "run_263",
    "run_280",
    "run_284",
    "run_290",
    "run_322",
    "run_337",
    "run_350",
    "run_354",
    "run_363",
    "run_372",
    "run_382",
    "run_387",
    "run_405",
    "run_410",
    "run_424",
    "run_428",
    "run_429",
    "run_436",
    "run_472"
  ]
}
